artist,song,link,text
ABBA,Dancing Queen,/a/abba/dancing+queen.html,You can dance, you can jive, having the time of your life...
The Beatles,Hey Jude,/b/beatles/hey+jude.html,Hey Jude, don't make it bad, take a sad song and make it better...
Queen,Bohemian Rhapsody,/q/queen/bohemian+rhapsody.html,Is this the real life? Is this just fantasy? Caught in a landslide, no escape from reality...
Adele,Someone Like You,/a/adele/someone+like+you.html,Nevermind I'll find someone like you, I wish nothing but the best for you too...
Ed Sheeran,Shape of You,/e/edsheeran/shape+of+you.html,The club isn't the best place to find a lover so the bar is where I go...
Eminem,Lose Yourself,/e/eminem/lose+yourself.html,Look, if you had one shot or one opportunity to seize everything you ever wanted in one moment...
